{
  "formatVersion": 1,
  "id": "p11-final-delete-15",
  "operation": "delete",
  "planPath": "docs/guards/plans/20260921-v3-stage-p11-final-aggregate.plan.json",
  "decisionPaths": [
    "docs/guards/V3_ifx/shared/decisions/history/20260921-v3-stage-d36-p11-minimal-compat-bridge.json",
    "docs/guards/V3_ifx/shared/decisions/history/20260921-v3-stage-d37-p11-candidate-layout-compatibility.json",
    "docs/guards/V3_ifx/shared/decisions/history/20260921-v3-stage-d38-cross-platform-inventory-bytes.json"
  ],
  "source": {
    "path": "docs/guards/V3_ifx/profiles/ifx/project-map.json",
    "base": {
      "mode": "100644",
      "type": "blob",
      "objectId": "9ca56550742d48eb494051634e64b28e06802d13"
    }
  },
  "changedPaths": [
    "docs/guards/V3_ifx/profiles/ifx/project-map.json"
  ],
  "entries": [
    {
      "path": "docs/guards/V3_ifx/profiles/ifx/project-map.json",
      "base": {
        "mode": "100644",
        "type": "blob",
        "objectId": "9ca56550742d48eb494051634e64b28e06802d13"
      },
      "head": null
    }
  ]
}
