{
  "formatVersion": 1,
  "id": "cp10-base-compat-trusted-base",
  "operation": "change-trusted-base",
  "planPath": "docs/guards/plans/20260920-v3-stage-cp10-base-compat.plan.json",
  "decisionPaths": [
    "docs/guards/V3_ifx/decisions/history/20260917-v3-stage-d19-trusted-base-first-introduction.json",
    "docs/guards/V3_ifx/decisions/history/20260917-v3-stage-d23-protected-change-obligations.json"
  ],
  "changedPaths": [
    "docs/guards/V3_ifx/tests/Test-IFXCiContract.ps1"
  ],
  "components": [
    "tcb.validation.package-tests"
  ],
  "entries": [
    {
      "path": "docs/guards/V3_ifx/tests/Test-IFXCiContract.ps1",
      "component": "tcb.validation.package-tests",
      "base": {
        "mode": "100644",
        "type": "blob",
        "objectId": "ecd461da24a011f6982d5ee32f6862cdafe50f8e"
      },
      "head": {
        "mode": "100644",
        "type": "blob",
        "objectId": "a3e6b5cd9085d27f97782ef48ae35e74e508dec3"
      }
    }
  ],
  "validationSuite": [
    "v3-architecture",
    "v3-cross-platform-*"
  ],
  "parityContract": "Production verifier, workflow, required checks and all verdicts are unchanged; only the base-owned test selects the declaration format present in the candidate package.",
  "allowedBehaviorDifferences": [
    {
      "mode": "Validate",
      "reason": "Authorization-only plan files make the base generated documentation view stale; the candidate test bridge changes no renderer or production validator, and every other Validate check plus all five verdict parity modes remains equal."
    }
  ]
}
