{
  "formatVersion": 1,
  "id": "p11-final-delete-18",
  "operation": "delete",
  "planPath": "docs/guards/plans/20260921-v3-stage-p11-final-aggregate.plan.json",
  "decisionPaths": [
    "docs/guards/V3_ifx/shared/decisions/history/20260921-v3-stage-d36-p11-minimal-compat-bridge.json",
    "docs/guards/V3_ifx/shared/decisions/history/20260921-v3-stage-d37-p11-candidate-layout-compatibility.json",
    "docs/guards/V3_ifx/shared/decisions/history/20260921-v3-stage-d38-cross-platform-inventory-bytes.json"
  ],
  "source": {
    "path": "docs/guards/V3_ifx/profiles/ifx/tech-stack.json",
    "base": {
      "mode": "100644",
      "type": "blob",
      "objectId": "f044060e181a11508efbb6e873e48c9359f750d8"
    }
  },
  "changedPaths": [
    "docs/guards/V3_ifx/profiles/ifx/tech-stack.json"
  ],
  "entries": [
    {
      "path": "docs/guards/V3_ifx/profiles/ifx/tech-stack.json",
      "base": {
        "mode": "100644",
        "type": "blob",
        "objectId": "f044060e181a11508efbb6e873e48c9359f750d8"
      },
      "head": null
    }
  ]
}
