{
  "formatVersion": 1,
  "id": "cp11o-decision-20260920-v3-stage-d31-shared-decision-history-move",
  "operation": "move",
  "planPath": "docs/guards/plans/20260920-v3-stage-cp11o-decision-history-relocation.plan.json",
  "decisionPaths": [
    "docs/guards/V3_ifx/shared/decisions/history/20260916-v3-stage-d07-migration-unit-and-order.json",
    "docs/guards/V3_ifx/shared/decisions/history/20260916-v3-stage-d15-trusted-base-component-upgrade.json",
    "docs/guards/V3_ifx/shared/decisions/history/20260917-v3-stage-d23-protected-change-obligations.json",
    "docs/guards/V3_ifx/shared/decisions/history/20260917-v3-stage-d24-policy-config-dual-track.json"
  ],
  "source": {
    "path": "docs/guards/V3_ifx/decisions/history/20260920-v3-stage-d31-shared-decision-history.json",
    "base": {
      "mode": "100644",
      "type": "blob",
      "objectId": "155ef603035b0f438fcc26ce7324b6076d2df17a"
    }
  },
  "destination": {
    "path": "docs/guards/V3_ifx/shared/decisions/history/20260920-v3-stage-d31-shared-decision-history.json",
    "base": null,
    "head": {
      "mode": "100644",
      "type": "blob",
      "objectId": "155ef603035b0f438fcc26ce7324b6076d2df17a"
    }
  },
  "changedPaths": [
    "docs/guards/V3_ifx/decisions/history/20260920-v3-stage-d31-shared-decision-history.json",
    "docs/guards/V3_ifx/shared/decisions/history/20260920-v3-stage-d31-shared-decision-history.json"
  ],
  "entries": [
    {
      "path": "docs/guards/V3_ifx/decisions/history/20260920-v3-stage-d31-shared-decision-history.json",
      "base": {
        "mode": "100644",
        "type": "blob",
        "objectId": "155ef603035b0f438fcc26ce7324b6076d2df17a"
      },
      "head": null
    },
    {
      "path": "docs/guards/V3_ifx/shared/decisions/history/20260920-v3-stage-d31-shared-decision-history.json",
      "base": null,
      "head": {
        "mode": "100644",
        "type": "blob",
        "objectId": "155ef603035b0f438fcc26ce7324b6076d2df17a"
      }
    }
  ]
}
