{
  "formatVersion": 1,
  "id": "p11-final-delete-10",
  "operation": "delete",
  "planPath": "docs/guards/plans/20260921-v3-stage-p11-final-aggregate.plan.json",
  "decisionPaths": [
    "docs/guards/V3_ifx/shared/decisions/history/20260921-v3-stage-d36-p11-minimal-compat-bridge.json",
    "docs/guards/V3_ifx/shared/decisions/history/20260921-v3-stage-d37-p11-candidate-layout-compatibility.json",
    "docs/guards/V3_ifx/shared/decisions/history/20260921-v3-stage-d38-cross-platform-inventory-bytes.json"
  ],
  "source": {
    "path": "docs/guards/V3_ifx/generated",
    "base": {
      "mode": "040000",
      "type": "tree",
      "objectId": "8064840f459ff95bcd26ebdf055eb8963d2f3741"
    }
  },
  "changedPaths": [
    "docs/guards/V3_ifx/generated/README.md",
    "docs/guards/V3_ifx/generated/stages/AssemblyGuardTests.cs",
    "docs/guards/V3_ifx/generated/stages/GuardTests.cs",
    "docs/guards/V3_ifx/generated/stages/GuardV3.Tests.csproj",
    "docs/guards/V3_ifx/generated/stages/profile.json",
    "docs/guards/V3_ifx/generated/stages/project-map.json",
    "docs/guards/V3_ifx/generated/stages/rules/ARCH.BINARY.DOMAIN.CONTRACTS.json",
    "docs/guards/V3_ifx/generated/stages/rules/ARCH.SEMANTIC.json",
    "docs/guards/V3_ifx/generated/stages/rules/L1.2.json",
    "docs/guards/V3_ifx/generated/stages/rules/L2.2.json",
    "docs/guards/V3_ifx/generated/stages/rules/L2.3.json",
    "docs/guards/V3_ifx/generated/stages/rules/L2.4.json",
    "docs/guards/V3_ifx/generated/stages/rules/L2.9.json",
    "docs/guards/V3_ifx/generated/stages/rules/L3.1.json",
    "docs/guards/V3_ifx/generated/stages/rules/L3.4.json",
    "docs/guards/V3_ifx/generated/stages/rules/L3.5.json",
    "docs/guards/V3_ifx/generated/stages/rules/L3.6.json",
    "docs/guards/V3_ifx/generated/stages/tech-stack.json"
  ],
  "entries": [
    {
      "path": "docs/guards/V3_ifx/generated/README.md",
      "base": {
        "mode": "100644",
        "type": "blob",
        "objectId": "69c54c14b284a21006b28d70d01a8af03b49820f"
      },
      "head": null
    },
    {
      "path": "docs/guards/V3_ifx/generated/stages/AssemblyGuardTests.cs",
      "base": {
        "mode": "100644",
        "type": "blob",
        "objectId": "bf1a49355e41e85ef363d14e4996a6682a9c91aa"
      },
      "head": null
    },
    {
      "path": "docs/guards/V3_ifx/generated/stages/GuardTests.cs",
      "base": {
        "mode": "100644",
        "type": "blob",
        "objectId": "94b38f768fe2b6bd82abbdcbd0395583e8a1a09b"
      },
      "head": null
    },
    {
      "path": "docs/guards/V3_ifx/generated/stages/GuardV3.Tests.csproj",
      "base": {
        "mode": "100644",
        "type": "blob",
        "objectId": "4b92009109bc970968f9984cd65233076afe547b"
      },
      "head": null
    },
    {
      "path": "docs/guards/V3_ifx/generated/stages/profile.json",
      "base": {
        "mode": "100644",
        "type": "blob",
        "objectId": "fdd8286ae6e3ce0f73d4c29afdae005d264f1a71"
      },
      "head": null
    },
    {
      "path": "docs/guards/V3_ifx/generated/stages/project-map.json",
      "base": {
        "mode": "100644",
        "type": "blob",
        "objectId": "9ca56550742d48eb494051634e64b28e06802d13"
      },
      "head": null
    },
    {
      "path": "docs/guards/V3_ifx/generated/stages/rules/ARCH.BINARY.DOMAIN.CONTRACTS.json",
      "base": {
        "mode": "100644",
        "type": "blob",
        "objectId": "c24c8f475b66ac6443cb7e6cb4a3bf1a383fc6c3"
      },
      "head": null
    },
    {
      "path": "docs/guards/V3_ifx/generated/stages/rules/ARCH.SEMANTIC.json",
      "base": {
        "mode": "100644",
        "type": "blob",
        "objectId": "c2e56bbaf757a8e17ac1b59073c3cecbe42707a3"
      },
      "head": null
    },
    {
      "path": "docs/guards/V3_ifx/generated/stages/rules/L1.2.json",
      "base": {
        "mode": "100644",
        "type": "blob",
        "objectId": "ffae770f7a54d999395887f3c06aaa6d19d6e645"
      },
      "head": null
    },
    {
      "path": "docs/guards/V3_ifx/generated/stages/rules/L2.2.json",
      "base": {
        "mode": "100644",
        "type": "blob",
        "objectId": "146eea6a09e37286a84e850e833024cb97169aa6"
      },
      "head": null
    },
    {
      "path": "docs/guards/V3_ifx/generated/stages/rules/L2.3.json",
      "base": {
        "mode": "100644",
        "type": "blob",
        "objectId": "0248f33a9ec7c4160c174885d2041d4a921fdd8a"
      },
      "head": null
    },
    {
      "path": "docs/guards/V3_ifx/generated/stages/rules/L2.4.json",
      "base": {
        "mode": "100644",
        "type": "blob",
        "objectId": "9cb54bae17e5c8811ad71e199507971808ac358c"
      },
      "head": null
    },
    {
      "path": "docs/guards/V3_ifx/generated/stages/rules/L2.9.json",
      "base": {
        "mode": "100644",
        "type": "blob",
        "objectId": "2c589c3a1e893193783bc9070eb9f912a147fabe"
      },
      "head": null
    },
    {
      "path": "docs/guards/V3_ifx/generated/stages/rules/L3.1.json",
      "base": {
        "mode": "100644",
        "type": "blob",
        "objectId": "e806579ee26ade1523f10682fe60b4c36932a45c"
      },
      "head": null
    },
    {
      "path": "docs/guards/V3_ifx/generated/stages/rules/L3.4.json",
      "base": {
        "mode": "100644",
        "type": "blob",
        "objectId": "1ebac46a91558ce8450345b6391f91d31b1ee15b"
      },
      "head": null
    },
    {
      "path": "docs/guards/V3_ifx/generated/stages/rules/L3.5.json",
      "base": {
        "mode": "100644",
        "type": "blob",
        "objectId": "2370ddd46f90724de48c085cc61970970c564e75"
      },
      "head": null
    },
    {
      "path": "docs/guards/V3_ifx/generated/stages/rules/L3.6.json",
      "base": {
        "mode": "100644",
        "type": "blob",
        "objectId": "7e730e779c5906c9e17c4494408c59012269cdd8"
      },
      "head": null
    },
    {
      "path": "docs/guards/V3_ifx/generated/stages/tech-stack.json",
      "base": {
        "mode": "100644",
        "type": "blob",
        "objectId": "f044060e181a11508efbb6e873e48c9359f750d8"
      },
      "head": null
    }
  ]
}
