{
  "formatVersion": 1,
  "id": "p11-cleanup-policy-compat-trusted-base",
  "operation": "change-trusted-base",
  "planPath": "docs/guards/plans/20260921-v3-stage-p11-cleanup-policy-compat.plan.json",
  "decisionPaths": [
    "docs/guards/V3_ifx/shared/decisions/history/20260916-v3-stage-d10-protected-change-authorization.json",
    "docs/guards/V3_ifx/shared/decisions/history/20260917-v3-stage-d19-trusted-base-first-introduction.json",
    "docs/guards/V3_ifx/shared/decisions/history/20260917-v3-stage-d24-policy-config-dual-track.json",
    "docs/guards/V3_ifx/shared/decisions/history/20260921-v3-stage-d36-p11-minimal-compat-bridge.json"
  ],
  "changedPaths": [
    "docs/guards/V3_ifx/trusted-base/Invoke-IFXTrustedBase.ps1"
  ],
  "components": [
    "tcb.engine.trusted-base"
  ],
  "entries": [
    {
      "path": "docs/guards/V3_ifx/trusted-base/Invoke-IFXTrustedBase.ps1",
      "component": "tcb.engine.trusted-base",
      "base": {
        "mode": "100644",
        "type": "blob",
        "objectId": "2f7dcb91b99c721be9306aa09548fd72c92f0883"
      },
      "head": {
        "mode": "100644",
        "type": "blob",
        "objectId": "3c9c6ea78235681c42f32000ced24aec2ebda78d"
      }
    }
  ],
  "validationSuite": [
    "docs/guards/V3_ifx/tests/support/Test-IFXDomainAuthorityCandidates.ps1",
    "docs/guards/V3_ifx/tests/support/Test-IFXTrustedBase.ps1"
  ],
  "parityContract": "Validate remains base-owned and fail-closed; only the exact four-entry legacy-to-canonical Architecture declaration covered by both named consumed P11.5 preparation authorizations may be projected into the disposable candidate package, with derived documentation rendered by the base generator.",
  "allowedBehaviorDifferences": []
}
