{
  "formatVersion": 1,
  "id": "cp09-move-analysis-deletion-manifest-r3",
  "operation": "move",
  "planPath": "docs/guards/plans/20260919-v3-stage-cp09-docs-analysis.plan.json",
  "decisionPaths": [
    "docs/guards/V3_ifx/decisions/history/20260916-v3-stage-d01-v3-ifx-distribution-boundary.json",
    "docs/guards/V3_ifx/decisions/history/20260916-v3-stage-d04-read-only-generated-markdown.json",
    "docs/guards/V3_ifx/decisions/history/20260916-v3-stage-d07-migration-unit-and-order.json",
    "docs/guards/V3_ifx/decisions/history/20260916-v3-stage-d09-trusted-base-guard-execution.json",
    "docs/guards/V3_ifx/decisions/history/20260916-v3-stage-d15-trusted-base-component-upgrade.json",
    "docs/guards/V3_ifx/decisions/history/20260917-v3-stage-d23-protected-change-obligations.json",
    "docs/guards/V3_ifx/decisions/history/20260917-v3-stage-d24-policy-config-dual-track.json"
  ],
  "source": {
    "path": "docs/guards/V3_ifx/analysis/ifx/legacy-deletion-manifest.json",
    "base": {
      "mode": "100644",
      "type": "blob",
      "objectId": "79eb39cde5441cf085d09e9d593550b3d2d94778"
    }
  },
  "destination": {
    "path": "docs/guards/V3_ifx/stages/analysis/evidence/legacy-deletion-manifest.json",
    "base": null,
    "head": {
      "mode": "100644",
      "type": "blob",
      "objectId": "79eb39cde5441cf085d09e9d593550b3d2d94778"
    }
  },
  "changedPaths": [
    "docs/guards/V3_ifx/analysis/ifx/legacy-deletion-manifest.json",
    "docs/guards/V3_ifx/stages/analysis/evidence/legacy-deletion-manifest.json"
  ],
  "entries": [
    {
      "path": "docs/guards/V3_ifx/analysis/ifx/legacy-deletion-manifest.json",
      "base": {
        "mode": "100644",
        "type": "blob",
        "objectId": "79eb39cde5441cf085d09e9d593550b3d2d94778"
      },
      "head": null
    },
    {
      "path": "docs/guards/V3_ifx/stages/analysis/evidence/legacy-deletion-manifest.json",
      "base": null,
      "head": {
        "mode": "100644",
        "type": "blob",
        "objectId": "79eb39cde5441cf085d09e9d593550b3d2d94778"
      }
    }
  ]
}
