{
  "formatVersion": 1,
  "id": "cp06b1-policy-config-dual-track",
  "operation": "change-trusted-base",
  "planPath": "docs/guards/plans/20260917-v3-stage-cp06b1-policy-config-dual-track.plan.json",
  "decisionPaths": [
    "docs/guards/V3_ifx/decisions/history/20260917-v3-stage-d23-protected-change-obligations.json",
    "docs/guards/V3_ifx/decisions/history/20260917-v3-stage-d24-policy-config-dual-track.json"
  ],
  "changedPaths": [
    "docs/guards/V3_ifx/contracts/authorization.schema.json",
    "docs/guards/V3_ifx/contracts/policy-config.schema.json",
    "docs/guards/V3_ifx/contracts/protected-change-report.schema.json",
    "docs/guards/V3_ifx/generated/stages/GuardTests.cs",
    "docs/guards/V3_ifx/scripts/Invoke-IFXManifestCheck.ps1",
    "docs/guards/V3_ifx/shared/policy-config.json",
    "docs/guards/V3_ifx/shared/trusted-components.json",
    "docs/guards/V3_ifx/stages/diff/stage.json",
    "docs/guards/V3_ifx/templates/dotnet/GuardTests.cs.in",
    "docs/guards/V3_ifx/tests/Test-IFXManifests.ps1",
    "docs/guards/V3_ifx/tests/Test-IFXTrustedBase.ps1",
    "docs/guards/V3_ifx/trusted-base/Invoke-IFXTrustedBase.ps1",
    "docs/guards/V3_ifx/trusted-base/New-IFXTrustedBaseAuthorization.ps1",
    "docs/guards/V3_ifx/trusted-base/Test-IFXPolicyCandidates.ps1",
    "docs/guards/V3_ifx/trusted-base/Test-IFXProtectedChanges.ps1",
    "docs/guards/V3_ifx/trusted-base/TrustedBase.psm1"
  ],
  "components": [
    "tcb.contracts",
    "tcb.engine.trusted-base",
    "tcb.generated.stage-gate",
    "tcb.generator.stage-gate",
    "tcb.manifest",
    "tcb.validation.package-tests"
  ],
  "entries": [
    {
      "path": "docs/guards/V3_ifx/contracts/authorization.schema.json",
      "component": "tcb.contracts",
      "base": {
        "mode": "100644",
        "type": "blob",
        "objectId": "8ef08b2c564cca7422d2dd61b78583b9a85a5658"
      },
      "head": {
        "mode": "100644",
        "type": "blob",
        "objectId": "47f611a82f31c21fa316e480aa3e608f712cd9e9"
      }
    },
    {
      "path": "docs/guards/V3_ifx/contracts/policy-config.schema.json",
      "component": "tcb.contracts",
      "base": null,
      "head": {
        "mode": "100644",
        "type": "blob",
        "objectId": "91273685736b969fa493abb0d278607af0508e1a"
      }
    },
    {
      "path": "docs/guards/V3_ifx/contracts/protected-change-report.schema.json",
      "component": "tcb.contracts",
      "base": {
        "mode": "100644",
        "type": "blob",
        "objectId": "3c94c549945b96c509700e0b2eacf639db5ea8a5"
      },
      "head": {
        "mode": "100644",
        "type": "blob",
        "objectId": "ad483e92182d49b2b6d2f3fddf265bac56e79f04"
      }
    },
    {
      "path": "docs/guards/V3_ifx/generated/stages/GuardTests.cs",
      "component": "tcb.generated.stage-gate",
      "base": {
        "mode": "100644",
        "type": "blob",
        "objectId": "b0ea2a2d34b8532bd9b4fbe808aaf7a5184e4fd8"
      },
      "head": {
        "mode": "100644",
        "type": "blob",
        "objectId": "94b38f768fe2b6bd82abbdcbd0395583e8a1a09b"
      }
    },
    {
      "path": "docs/guards/V3_ifx/scripts/Invoke-IFXManifestCheck.ps1",
      "component": "tcb.manifest",
      "base": {
        "mode": "100644",
        "type": "blob",
        "objectId": "d4f8f49a47f7a88d24b37f91c19c847d1dc07cfd"
      },
      "head": {
        "mode": "100644",
        "type": "blob",
        "objectId": "b7c82e609b93a9fbb83a56ff7a1ee0566a9fcaad"
      }
    },
    {
      "path": "docs/guards/V3_ifx/shared/policy-config.json",
      "component": "tcb.manifest",
      "base": null,
      "head": {
        "mode": "100644",
        "type": "blob",
        "objectId": "80321b9af799e1debcdcbda23532a6ea82f29cd3"
      }
    },
    {
      "path": "docs/guards/V3_ifx/shared/trusted-components.json",
      "component": "tcb.manifest",
      "base": {
        "mode": "100644",
        "type": "blob",
        "objectId": "a0183949a8d1410f23ef4eb21c015fd66b394c92"
      },
      "head": {
        "mode": "100644",
        "type": "blob",
        "objectId": "4adefe23c67a13c8cfe52fb91184907e565ee84c"
      }
    },
    {
      "path": "docs/guards/V3_ifx/stages/diff/stage.json",
      "component": "tcb.manifest",
      "base": {
        "mode": "100644",
        "type": "blob",
        "objectId": "40202a0e0f035903850511e6952387e681fcc49a"
      },
      "head": {
        "mode": "100644",
        "type": "blob",
        "objectId": "07bd1e254c44ae397e2a34b7e7b74c1bad3e5913"
      }
    },
    {
      "path": "docs/guards/V3_ifx/templates/dotnet/GuardTests.cs.in",
      "component": "tcb.generator.stage-gate",
      "base": {
        "mode": "100644",
        "type": "blob",
        "objectId": "b0ea2a2d34b8532bd9b4fbe808aaf7a5184e4fd8"
      },
      "head": {
        "mode": "100644",
        "type": "blob",
        "objectId": "94b38f768fe2b6bd82abbdcbd0395583e8a1a09b"
      }
    },
    {
      "path": "docs/guards/V3_ifx/tests/Test-IFXManifests.ps1",
      "component": "tcb.validation.package-tests",
      "base": {
        "mode": "100644",
        "type": "blob",
        "objectId": "e26ed05af362e1d1d2ca9951f334877e86974f94"
      },
      "head": {
        "mode": "100644",
        "type": "blob",
        "objectId": "17d95ace72073da667585cee9299844078193866"
      }
    },
    {
      "path": "docs/guards/V3_ifx/tests/Test-IFXTrustedBase.ps1",
      "component": "tcb.validation.package-tests",
      "base": {
        "mode": "100644",
        "type": "blob",
        "objectId": "7897eb4527f8f9a014a1a2e162315b6fbdb35bd8"
      },
      "head": {
        "mode": "100644",
        "type": "blob",
        "objectId": "b349dd28386a08260709db34847ac6039b2be3f2"
      }
    },
    {
      "path": "docs/guards/V3_ifx/trusted-base/Invoke-IFXTrustedBase.ps1",
      "component": "tcb.engine.trusted-base",
      "base": {
        "mode": "100644",
        "type": "blob",
        "objectId": "273050fcb0eb238f5ac4c6bb2807acdbf3f69a9c"
      },
      "head": {
        "mode": "100644",
        "type": "blob",
        "objectId": "2916bd3e12b768d2d2163d217de4461ec9227c88"
      }
    },
    {
      "path": "docs/guards/V3_ifx/trusted-base/New-IFXTrustedBaseAuthorization.ps1",
      "component": "tcb.engine.trusted-base",
      "base": {
        "mode": "100644",
        "type": "blob",
        "objectId": "98e399e4a2c389aef65bd558e8fb82f45de09389"
      },
      "head": {
        "mode": "100644",
        "type": "blob",
        "objectId": "8e6ff561f2ff72281c42c127f15939e4e31540ff"
      }
    },
    {
      "path": "docs/guards/V3_ifx/trusted-base/Test-IFXPolicyCandidates.ps1",
      "component": "tcb.engine.trusted-base",
      "base": null,
      "head": {
        "mode": "100644",
        "type": "blob",
        "objectId": "1f579a3c51f920e563839dc857886e766f7a0d12"
      }
    },
    {
      "path": "docs/guards/V3_ifx/trusted-base/Test-IFXProtectedChanges.ps1",
      "component": "tcb.engine.trusted-base",
      "base": {
        "mode": "100644",
        "type": "blob",
        "objectId": "3bf2e5a7183d3ac12f91ceb32639e0ca94fe3463"
      },
      "head": {
        "mode": "100644",
        "type": "blob",
        "objectId": "bb39115d3159bc11560617c34676689d5d90d02e"
      }
    },
    {
      "path": "docs/guards/V3_ifx/trusted-base/TrustedBase.psm1",
      "component": "tcb.engine.trusted-base",
      "base": {
        "mode": "100644",
        "type": "blob",
        "objectId": "0e2281934ab485996f4808151c07fa023f3b28cd"
      },
      "head": {
        "mode": "100644",
        "type": "blob",
        "objectId": "ee8c8b2370af0f47e9a20f1a5768929f4469a8fc"
      }
    }
  ],
  "validationSuite": [
    "docs/guards/V3_ifx/tests/Test-IFXDomainAuthorityCandidates.ps1",
    "docs/guards/V3_ifx/tests/Test-IFXManifests.ps1",
    "docs/guards/V3_ifx/tests/Test-IFXPre.ps1",
    "docs/guards/V3_ifx/tests/Test-IFXTrustedBase.ps1",
    "docs/guards/V3_ifx/tests/Test-V3.ps1",
    "Invoke-IFXGuardrails.ps1 -Mode Validate",
    "Invoke-IFXGuardrails.ps1 -Mode Validate (manifest-check)",
    "Invoke-V3.ps1 -Mode Check",
    "v3-architecture",
    "v3-cross-platform-*",
    "v3-pre-diff"
  ],
  "parityContract": "Verdicts of Validate, HistoricalIntegrity, G03, G04, G05 and Plan04 on the fixed corpus are unchanged. The trusted Diff adds policy-weakening obligations for registered policy and configuration, enables weaken-policy, validates head policy candidates from the explicit head commit, binds the report to the registry and authorization schema hashes, and the generic Diff no longer honours the legacy consumption variable.",
  "allowedBehaviorDifferences": []
}
