{
  "formatVersion": 1,
  "id": "cp11n-test-ifx-target-root-separation-move",
  "operation": "move",
  "planPath": "docs/guards/plans/20260920-v3-stage-cp11n-test-layout-relocation.plan.json",
  "decisionPaths": [
    "docs/guards/V3_ifx/decisions/history/20260916-v3-stage-d15-trusted-base-component-upgrade.json",
    "docs/guards/V3_ifx/decisions/history/20260917-v3-stage-d23-protected-change-obligations.json"
  ],
  "source": {
    "path": "docs/guards/V3_ifx/tests/Test-IFXTargetRootSeparation.ps1",
    "base": {
      "mode": "100644",
      "type": "blob",
      "objectId": "8dc9429ab736bf49a0aec73c4f5180382b420784"
    }
  },
  "destination": {
    "path": "docs/guards/V3_ifx/tests/support/Test-IFXTargetRootSeparation.ps1",
    "base": null,
    "head": {
      "mode": "100644",
      "type": "blob",
      "objectId": "d5167a6b0819ed8da8cefcf1cd6bc54bd6f0f266"
    }
  },
  "changedPaths": [
    "docs/guards/V3_ifx/tests/support/Test-IFXTargetRootSeparation.ps1",
    "docs/guards/V3_ifx/tests/Test-IFXTargetRootSeparation.ps1"
  ],
  "entries": [
    {
      "path": "docs/guards/V3_ifx/tests/support/Test-IFXTargetRootSeparation.ps1",
      "base": null,
      "head": {
        "mode": "100644",
        "type": "blob",
        "objectId": "d5167a6b0819ed8da8cefcf1cd6bc54bd6f0f266"
      }
    },
    {
      "path": "docs/guards/V3_ifx/tests/Test-IFXTargetRootSeparation.ps1",
      "base": {
        "mode": "100644",
        "type": "blob",
        "objectId": "8dc9429ab736bf49a0aec73c4f5180382b420784"
      },
      "head": null
    }
  ]
}
