{
  "formatVersion": 1,
  "id": "cp11r-move-layerguard-fixture-apihost",
  "operation": "move",
  "planPath": "docs/guards/plans/20260920-v3-stage-cp11r-layerguard-post-relocation.plan.json",
  "decisionPaths": [
    "docs/guards/V3_ifx/shared/decisions/history/20260920-v3-stage-d34-layerguard-post-ownership.json",
    "docs/guards/V3_ifx/shared/decisions/history/20260916-v3-stage-d12-architecture-conformance-ownership.json",
    "docs/guards/V3_ifx/shared/decisions/history/20260918-v3-stage-d27-architecture-conformance-binding-separation.json",
    "docs/guards/V3_ifx/shared/decisions/history/20260918-v3-stage-d29-architecture-conformance-v3-relocation.json",
    "docs/guards/V3_ifx/shared/decisions/history/20260916-v3-stage-d15-trusted-base-component-upgrade.json",
    "docs/guards/V3_ifx/shared/decisions/history/20260917-v3-stage-d23-protected-change-obligations.json",
    "docs/guards/V3_ifx/shared/decisions/history/20260917-v3-stage-d24-policy-config-dual-track.json"
  ],
  "source": {
    "path": "docs/guards/V3_ifx/templates/ifx-layerguard/tests/LayerGuard.Ifx.Tests/fixtures/IfxBinding/IFX.ApiHost/IFX.ApiHost.csproj",
    "base": {
      "mode": "100644",
      "type": "blob",
      "objectId": "a6c0bce5fdf9d01ecbec5a7bd2f9ac264ddb5c4d"
    }
  },
  "destination": {
    "path": "docs/guards/V3_ifx/stages/post/gates/architecture/dotnet/tests/LayerGuard.Ifx.Tests/fixtures/IfxBinding/IFX.ApiHost/IFX.ApiHost.csproj",
    "base": null,
    "head": {
      "mode": "100644",
      "type": "blob",
      "objectId": "a6c0bce5fdf9d01ecbec5a7bd2f9ac264ddb5c4d"
    }
  },
  "changedPaths": [
    "docs/guards/V3_ifx/stages/post/gates/architecture/dotnet/tests/LayerGuard.Ifx.Tests/fixtures/IfxBinding/IFX.ApiHost/IFX.ApiHost.csproj",
    "docs/guards/V3_ifx/templates/ifx-layerguard/tests/LayerGuard.Ifx.Tests/fixtures/IfxBinding/IFX.ApiHost/IFX.ApiHost.csproj"
  ],
  "entries": [
    {
      "path": "docs/guards/V3_ifx/stages/post/gates/architecture/dotnet/tests/LayerGuard.Ifx.Tests/fixtures/IfxBinding/IFX.ApiHost/IFX.ApiHost.csproj",
      "base": null,
      "head": {
        "mode": "100644",
        "type": "blob",
        "objectId": "a6c0bce5fdf9d01ecbec5a7bd2f9ac264ddb5c4d"
      }
    },
    {
      "path": "docs/guards/V3_ifx/templates/ifx-layerguard/tests/LayerGuard.Ifx.Tests/fixtures/IfxBinding/IFX.ApiHost/IFX.ApiHost.csproj",
      "base": {
        "mode": "100644",
        "type": "blob",
        "objectId": "a6c0bce5fdf9d01ecbec5a7bd2f9ac264ddb5c4d"
      },
      "head": null
    }
  ]
}
